{
  "schemaVersion": "public-api-snapshot.v1",
  "package": "@taliya/ui",
  "runtimeExports": [
    "ActionMenu",
    "AttachmentList",
    "AuditTable",
    "Avatar",
    "AvatarStack",
    "Badge",
    "Breadcrumb",
    "Button",
    "ButtonGroup",
    "CalendarCell",
    "CalendarEventBlock",
    "CalendarGrid",
    "Card",
    "ChartPanelPrimitive",
    "Checkbox",
    "ChecklistItem",
    "Chip",
    "ComposerInput",
    "ConfidenceMeter",
    "ConfirmDialog",
    "ConflictCard",
    "ConnectorLine",
    "ContentGrid",
    "DataTable",
    "DateInput",
    "DiffTable",
    "DocumentPreview",
    "Drawer",
    "DrawerFooter",
    "DrawerHeader",
    "DrawerSection",
    "DropdownMenu",
    "EmptyState",
    "ErrorState",
    "ExecutionRow",
    "FieldGrid",
    "FieldGroup",
    "FieldStack",
    "FileUpload",
    "FilterBar",
    "FilterChip",
    "FilterMultiSelect",
    "FilterSelect",
    "FlowNode",
    "Icon",
    "IconButton",
    "ImportProgressCard",
    "InlineAlert",
    "InlineGroup",
    "Input",
    "KeyValueRow",
    "List",
    "ListIcon",
    "ListItem",
    "LoadingState",
    "MessageBubble",
    "MetaText",
    "MetricTile",
    "Modal",
    "MoneyInput",
    "NavPill",
    "Panel",
    "PanelBody",
    "PanelHeader",
    "PasswordInput",
    "PermissionTable",
    "PersonLabel",
    "Popover",
    "PrimitiveButton",
    "PrimitiveInput",
    "ProgressBar",
    "Radio",
    "RelationshipCard",
    "ScrollArea",
    "SearchInput",
    "SegmentedControl",
    "Select",
    "SocialAuthButton",
    "Stack",
    "StatePage",
    "StatusDot",
    "StatusSummaryCard",
    "Stepper",
    "TablePagination",
    "Tabs",
    "TagInput",
    "TaliyaLogo",
    "Textarea",
    "TimeInput",
    "Timeline",
    "Toast",
    "Toggle",
    "Toolbar",
    "Tooltip",
    "cn",
    "iconButtonIconSizeTokenBySize",
    "iconRegistry",
    "iconSizeTokenByName"
  ],
  "typeExports": [
    "AttachmentItem",
    "AuditTableProps",
    "AuditTableRow",
    "AuditTableStatus",
    "AvatarProps",
    "AvatarStackPerson",
    "BadgeProps",
    "BreadcrumbItem",
    "ButtonProps",
    "ButtonVariant",
    "CalendarCellEvent",
    "CalendarCellProps",
    "CalendarEventBlockProps",
    "CalendarEventBlockStatus",
    "CalendarGridProps",
    "CardProps",
    "ChartPanelDatum",
    "ChartPanelPrimitiveProps",
    "CheckboxProps",
    "ChecklistItemProps",
    "ChecklistItemState",
    "ChipProps",
    "ComponentTone",
    "ComposerInputProps",
    "ConfidenceMeterLevel",
    "ConfidenceMeterProps",
    "ConfirmDialogProps",
    "ConflictCardProps",
    "ConflictCardState",
    "ConnectorLineProps",
    "ContentGridProps",
    "DataTableColumn",
    "DataTableProps",
    "DataTableSortDirection",
    "DataTableSortState",
    "DiffRowStatus",
    "DiffTableProps",
    "DiffTableRow",
    "DocumentPreviewHistoryItem",
    "DocumentPreviewPage",
    "DocumentPreviewProps",
    "DocumentPreviewState",
    "DrawerFooterProps",
    "DrawerHeaderProps",
    "DrawerProps",
    "DrawerSectionProps",
    "DropdownAction",
    "DropdownMenuProps",
    "EmptyStateProps",
    "ErrorStateProps",
    "ExecutionRowProps",
    "ExecutionRowStatus",
    "FieldBaseProps",
    "FieldGridProps",
    "FieldGroupProps",
    "FieldStackProps",
    "FieldState",
    "FileUploadProps",
    "FilterChipProps",
    "FilterMultiSelectProps",
    "FilterSelectOption",
    "FilterSelectProps",
    "FlowNodeProps",
    "FlowNodeVariant",
    "IconButtonProps",
    "IconButtonVariant",
    "IconName",
    "IconProps",
    "ImportProgressCardProps",
    "ImportProgressCardState",
    "ImportProgressMetric",
    "InlineAlertProps",
    "InlineGroupProps",
    "InputProps",
    "KeyValueRowProps",
    "ListIconProps",
    "ListItemProps",
    "ListProps",
    "LoadingStateProps",
    "MessageBubbleProps",
    "MessageBubbleVariant",
    "MetaTextProps",
    "MetricTileProps",
    "MetricTileTone",
    "ModalProps",
    "NavPillProps",
    "PanelBodyProps",
    "PanelHeaderProps",
    "PanelProps",
    "PasswordInputProps",
    "PermissionTableProps",
    "PermissionTableRow",
    "PermissionTableState",
    "PersonLabelProps",
    "PopoverProps",
    "ProgressBarProps",
    "RadioProps",
    "RelationshipCardProps",
    "RelationshipCardVariant",
    "SearchInputProps",
    "SegmentedControlOption",
    "SelectOption",
    "SelectProps",
    "Size",
    "SocialAuthButtonProps",
    "StackProps",
    "StatePageProps",
    "StatusDotProps",
    "StatusDotStatus",
    "StatusSummaryCardProps",
    "StatusSummaryState",
    "StepperProps",
    "StepperStep",
    "StepperStepState",
    "TabItem",
    "TablePaginationProps",
    "TagInputItem",
    "TagInputProps",
    "TaliyaLogoProps",
    "TextareaProps",
    "TimelineItem",
    "ToggleProps",
    "ToolbarProps",
    "TooltipProps"
  ],
  "styleExports": [
    "./styles.css"
  ],
  "exportMap": {
    ".": {
      "types": "./dist/index.d.ts",
      "import": "./dist/index.js"
    },
    "./styles.css": "./src/styles.css"
  },
  "fingerprint": "70e691c0c16baf74efc82b545d224f2d421399a56c60042b44b2bd97818b0d27"
}
